ID;STATION CODE;LOCATIONS;STATE;Temp;TempW;DO;DOW;Conductivity;ConductivityW;NI;NIW;WQI;WQI clf
952;1450;PALAR AT VANIYAMBADI WATER SUPPLY HEAD WORK. TAMILNADU;TAMIL NADU;28.4;0.66;6.3;0.56;830;0.012;0.24;0.00211611;83.24285739;0
954;1885;RIVER GHAGGAR AT D/S OF SURAJPUR;HARYANA;27;0.58;6.9;0.61;440;0.007;1.21;0.011040574;86.50918899;0
955;1023;GHAGGAR AT MUBARAKPUR REST HOUSE (PATIALA). PUNJAB;PUNJAB;24.8;0.46;5.8;0.51;732;0.011;3.83;0.035145828;146.7606988;0
956;1024;GHAGGAR AT 100M D/S CONF. WITH R. SARASWATI (PATIALA).PUNJAB;PUNJAB;24;0.42;5.6;0.5;1322;0.02;15;0.137915172;566.9132661;0
957;1295;GHAGGAR NEAR BANKARPUR.DERA BASSI.PUNJAB;PUNJAB;25;0.47;5.4;0.48;809;0.012;4.2;0.038550005;235.14348;0
958;1473;GHAGGAR AT RATANHERI. D/S OF PATIALA NADI (AFTER CONFL.). PUNJAB;PUNJAB;23.3;0.38;5.7;0.5;1103;0.017;13.75;0.126414574;635.4293325;0
959;1698;GHAGGAR AT D/S CHHATBIR;PUNJAB;25.8;0.52;5.7;0.5;906;0.014;14.18;0.130370779;443.3442058;0
960;1699;GHAGGAR AT U/S DHAKANSU NALLAH. PUNJAB;PUNJAB;25.8;0.52;3.5;0.3;1064;0.016;13.2;0.12135431;419.0519322;0
961;1700;GHAGGAR AT D/S DHAKANSU NALLAH. PUNJAB;PUNJAB;25.8;0.52;3.2;0.28;1197;0.018;19.2;0.176557181;765.662053;0
962;1701;GHAGGAR AT D/S JHARMAL NADI;PUNJAB;26;0.53;4.7;0.41;1383;0.021;16.4;0.150795841;672.6858354;0
963;1702;GHAGGAR AT U/S JHARMAL NADI;PUNJAB;26;0.53;4.8;0.42;1063;0.016;5.03;0.046186402;267.6216284;0
964;1703;GHAGGAR AT MOONAK. PUNJAB;PUNJAB;24.4;0.44;5.3;0.47;1532;0.023;15.8;0.145275554;828.1471936;0
965;1704;GHAGGAR AT D/S SARDULGARH;PUNJAB;23.4;0.38;5.6;0.5;1269;0.019;12.15;0.111693808;858.3794061;0
966;1705;GHAGGAR AT U/S SARDULGARH;PUNJAB;24.3;0.43;5.4;0.48;1194;0.018;8.3;0.076271966;475.8181467;0
967;1025;GHAGGAR GHNAN1 AT ROAD BRDG. SIRSA.DEBWALI ROAD.HARYANA;HARYANA;17.7;0.07;6.1;0.54;780;0.012;0.52;0.004692244;173.0248446;0
968;1026;GHAGGAR GHNAN2 AT CHANDARPUR SYPHON.  HARYANA;HARYANA;17;0.03;6.1;0.54;773;0.012;0.52;0.004692244;173.0233046;0
969;1887;GHAGGAR BEFORE OTTU WEIR (BEFORE MIXING OF SATLUJ CANAL WATER) (HARYANA);HARYANA;17.3;0.04;6;0.53;820;0.012;0.52;0.004692244;182.2979316;0
970;1718;GAGGAR RIVER WHEN ENTERING IN RAJASTHAN FROM HARYANA NEAR RD NO. 629. RAJASTHAN;RAJASTHAN;28;0.64;4.8;0.42;650;0.01;0.68;0.006164321;91.46050841;0
971;1719;GAGGAR RIVER D/S HANUMANGARH NEAR 2 KNJ NAI ABADI. MAKKASR;RAJASTHAN;32;0.86;5;0.44;390;0.006;0.14;0.001196062;76.37185449;0
974;1884;KALA AMB D/S MARKANDA RIVER;HARYANA;18.3;0.1;3.1;0.27;1261;0.019;4.78;0.043886282;1804.945433;0
976;1870;RIVER SUKHANA AT PARWANOO. DISTT. SOLAN. H.P.;HIMACHAL PRADESH;21.8;0.29;5.5;0.49;743;0.011;1.02;0.009292483;123.571713;0
978;2947;RIVER JAWAI AT JAWAI DAM. SIROHI. RAJASTHAN;RAJASTHAN;27.3;0.6;5.3;0.47;623;0.009;0.52;0.004692244;79.12300029;0
979;2869;BARAK RIVER AT SENAPATI ;MANIPUR;19;0.14;8.7;0.78;252;0.004;0.52;0.004692244;78.75872377;0
986;2861;IMPHAL AT KANGLA MOAT. IMPHAL ;MANIPUR;23;0.36;5.5;0.49;116;0.002;0.52;0.004692244;116.6454464;0
993;2873;IRIL RIVER AT LILONG (THOUBAL );MANIPUR;30;0.75;5.8;0.51;367;0.005;0.52;0.004692244;116.4138455;0
998;2867;MAHA RIVER AT CHANDEL. MANIPUR;MANIPUR;23.5;0.39;5.2;0.46;164;0.002;0.52;0.004692244;76.99040725;0
999;2852;MANIPUR RIVER AT SEKMAIJAN. DISTT. THOUBAL. MANIPUR;MANIPUR;23;0.36;4.6;0.4;188;0.003;0.52;0.004692244;78.14576899;0
1001;1625;NAMBUL RIVER AT HUMP BRIDGE;MANIPUR;23;0.36;1.9;0.16;484;0.007;0.52;0.004692244;198.6107768;0
1002;1626;NAMBUL RIVER AT HEIRANGOITHONG. MANIPUR;MANIPUR;23;0.36;2.5;0.21;424;0.006;0.52;0.004692244;213.2253951;0
1004;2859;NAMBUL RIVER AT SINGDA DAM. IMPHAL WEST. MANIPUR;MANIPUR;23;0.36;6;0.53;100;0.001;0.52;0.004692244;83.78223159;0
1005;2860;NAMBUL RIVER AT NAOREMTHONG. IMPHAL WEST. MANIPUR;MANIPUR;22.5;0.33;4.9;0.43;93;0.001;0.52;0.004692244;82.02874812;0
1006;2880;NAMBUL RIVER AT  BISHNUPUR. MANIPUR;MANIPUR;20;0.19;4.8;0.42;;0;0.52;0.004692244;77.27733707;0
1009;2854;THOUBAL RIVER AT PHADOM. DISTT. THOUBAL. MANIPUR;MANIPUR;19;0.14;5.6;0.5;319;0.005;0.52;0.004692244;89.26225942;0
1012;2872;THOUBAL RIVER AT LITAN (UKL DIST.);MANIPUR;21;0.25;6.1;0.54;163;0.002;0.52;0.004692244;96.38990464;0
1014;2876;WANGJING RIVER AT WANGJING. DISTT. THOUBAL. MANIPUR;MANIPUR;23;0.36;3.8;0.33;192;0.003;0.52;0.004692244;83.76684464;0
1017;1631;MYNTDU RIVER JOWAI. MEGHALAYA;MEGHALAYA;20.8;0.24;7.3;0.65;162;0.002;0.69;0.006256325;101.3625878;0
1019;1427;UMTREW AT BYRNIHAT EAST;MEGHALAYA;24;0.42;7.7;0.69;205;0.003;0.84;0.007636397;103.82966;0
1022;2052;TUIRIAL UPPER CATCHMENT;MIZORAM;23.2;0.37;6.9;0.61;268;0.004;0.11;0.000920048;50.46462232;0
1025;1404;GUMTI AT D/S SOUTH TRIPURA;TRIPURA;28.6;0.67;6.3;0.56;164;0.002;0.3;0.002668139;95.97005739;0
1026;1726;CHANDRAPUR. AGARTALA D/S OF HAORA RIVER. TRIPURA;TRIPURA;28.5;0.67;6.6;0.59;196;0.003;0.8;0.007268378;102.7254032;0
1027;2459;DAMANGANGA AT ZARI CAUSE WAY BRIDGE. DAMAN ;DAMAN & DIU;29.9;0.74;5.6;0.5;15608;0.237;18.73;0.172232956;278.8709994;0
1028;2460;DAMANGANGA AT DISCHARG POINT DISTILLARY;DAMAN & DIU;29.9;0.74;3.7;0.32;39503;0.601;25.71;0.236452296;197.3736983;0
1029;2461;DAMANGANGA AT DAMAN JETTY. MOTI DAMAN;DAMAN & DIU;29.8;0.74;4.7;0.41;46170;0.703;19.69;0.181065415;265.923382;0
1030;2462;DAMANGANGA AT VAPI WEIR. VAPI;DAMAN & DIU;30.2;0.76;5.8;0.51;378;0.006;2.61;0.023921244;78.63159017;0
1031;2463;DAMANGANGA AT LAVACHA TEMPLE. DADRA;DAMAN & DIU;29.7;0.73;6.6;0.59;489;0.007;2.66;0.024381268;75.63718119;0
1035;1860;BALEHWAR KHADI AT N.H. NO. 8;GUJARAT;26;0.53;5.1;0.45;533;0.008;0.45;0.004048211;185.5581209;0
1036;1861;RIVER PURNA ON BRIDGE AT SURATNANNAVSARI HIGHWAY;GUJARAT;27;0.58;7.1;0.63;555;0.008;0.35;0.003128163;240.3558884;0
1037;1862;RIVER KAVERI ON BRIDGE AT BILLIMORANANVALSAD ROAD;GUJARAT;27;0.58;6.8;0.61;26600;0.405;0.62;0.005612292;295.6777693;0
1038;1865;RIVER DHADAR AT KOTHADA;GUJARAT;29.3;0.71;8.1;0.72;938;0.014;0.4;0.003588187;118.5739055;0
1039;1148;AMBIKA AT BILIMORA. ;GUJARAT;28.4;0.66;6.2;0.55;7778;0.118;0.26;0.00230012;145.035111;0
1040;1434;AMLAKHADI AFTER CONFL. OF W. WATER FROM ANKLESH.;GUJARAT;32;0.86;6.7;0.6;1440;0.022;0.2;0.001748091;450.8491362;0
1041;1438;MINDHOLA AT STATE HIGHWAY BRIDGE SACHIN. ;GUJARAT;28.3;0.66;3.2;0.28;885;0.013;0.51;0.004600239;211.310473;0
1059;2651;AMBA AT D/S OF WAKEN BDG U/S OF JS PETROCHEMICALS. WAKENPHATA. ROHA;MAHARASHTRA;28.7;0.68;6.8;0.61;119;0.002;0.58;0.005244273;90.65471594;0
1060;1461;BHATSA AT D/S OF PISE DAM NEAR PISE VILLAGE (ULHAS);MAHARASHTRA;26;0.53;7;0.62;88;0.001;0.13;0.001104057;77.25512203;0
1061;2653;BHATSA AT D/S OF LIBERTY OIL MILLS. SATNEL. SHAHAPUR. THANE;MAHARASHTRA;27;0.58;6.9;0.61;70;0.001;0.19;0.001656086;77.63626899;0
1063;1092;KALU AT ATALE VILLAGE;MAHARASHTRA;24;0.42;7;0.62;3113;0.047;2.16;0.019781029;82.0121287;0
1064;2670;KAN NEAR SAKRI WATER WORKS. SAKRI. DHULE;MAHARASHTRA;32.1;0.87;5.5;0.49;363;0.005;2.15;0.019689024;137.9154197;0
1065;1152;KUNDALIKA AT ROHA CITY;MAHARASHTRA;30.3;0.77;6.9;0.61;86;0.001;0.4;0.003588187;84.76518899;0
1066;2198;KUNDALIKA RIVER AT ARE KHURD ( SALINE ZONE );MAHARASHTRA;30.1;0.76;6.4;0.57;621;0.009;1.79;0.016376852;390.6185171;0
1067;2671;KUNDALIKA NEAR SALAV BDG (SALINA ZONE). SALAV. ROHA. RAIGAD;MAHARASHTRA;28.8;0.68;5.2;0.46;42354;0.645;1.1;0.010028521;157.2185806;0
1068;2672;KUNDALIKA  AT DHATAV AT JACKWELL. DHATAV. ROHA. RAIGAD;MAHARASHTRA;28.7;0.68;6.9;0.61;73;0.001;0.27;0.002392124;85.81245565;0
1069;2168;MITHI RIVER;MAHARASHTRA;29;0.69;3.4;0.29;17842;0.271;3.32;0.030453584;383.3914058;0
1071;1151;PATALGANGA AT SHILPHATA;MAHARASHTRA;27.7;0.62;6.7;0.6;125;0.002;0.4;0.003588187;89.3133029;0
1072;1462;PATALGANGA NEAR INTAKE OF MIDC W/W;MAHARASHTRA;28.6;0.67;6.6;0.59;129;0.002;0.4;0.003588187;84.69658986;0
1073;2685;PATALGANGA AT D/S OF KHARPADA BDG. KHARPADA. KHALAPUR. RAIGAD;MAHARASHTRA;27.1;0.59;6.1;0.54;515;0.008;2.02;0.018492962;93.43858464;0
1074;2686;PATALGANGA AT VYAL PUMP HOUSE. VYAL. KHALAPUR. RAIGAD;MAHARASHTRA;27.1;0.59;6.6;0.59;122;0.002;0.46;0.004140215;81.25590986;0
1075;2687;PATALGANGA AT KHALAPUR PUMPING STATION. RAIGAD;MAHARASHTRA;27;0.58;6.5;0.58;131;0.002;0.79;0.007176373;80.37305681;0
1076;2688;PATALGANGA AT SAVROLI BDG. KHALAPUR. RAIGAD;MAHARASHTRA;26.8;0.57;6.7;0.6;130;0.002;0.57;0.005152268;76.41084957;0
1077;2689;PATALGANGA RIVER AT GAGANGIRI MAHARAJ TEMPLE. KHOPOLI. KHALAPUR. RAIGAD;MAHARASHTRA;26.8;0.57;6.6;0.59;95;0.001;0.53;0.004784249;81.55864319;0
1078;2696;PEHLAR DAM ON PEHLAR RIVERNANINLET OF WATER WORKS. VASAI. THANE;MAHARASHTRA;26.4;0.55;6.8;0.61;143;0.002;0.43;0.003864201;82.48623594;0
1079;2199;SAVITRI AT OVALE VILLAGE.;MAHARASHTRA;22.1;0.31;6.3;0.56;10825;0.165;1.93;0.017664919;77.00625072;0
1084;2706;SURYA U/S OF SURYA DAM. DHAMMI. VIKRAMGAD. THANE;MAHARASHTRA;28.2;0.65;7.1;0.63;193;0.003;0.53;0.004784249;76.70146841;0
1085;2707;SURYA AT MIDC PUMPING STATION. GARVASHET. PALGHAR. THANE;MAHARASHTRA;28.2;0.65;7.1;0.63;175;0.002;0.47;0.00423222;79.94062841;0
1086;2708;SURYA RIVER AT INTAKE OF VASAINANVIRAR W/S SCHEME. MASVAN. PALGHAR. THANE;MAHARASHTRA;28.3;0.66;7.1;0.63;174;0.002;0.44;0.003956206;80.01506841;0
1087;2709;TANSA NEAR ROAD BDG. VILL DAKEWALI. WADA. THANE;MAHARASHTRA;27;0.58;7.2;0.64;308;0.005;0.15;0.001288067;85.02419478;0
1088;1093;ULHAS AT U/S OF NRC BUND AT MOHANE;MAHARASHTRA;26.3;0.54;6.4;0.57;153;0.002;0.77;0.006992364;94.8548171;0
1089;1094;ULHAS AT U/S OF BADLAPUR;MAHARASHTRA;26.1;0.53;7;0.62;111;0.002;0.42;0.003772196;82.9166287;0
1090;2162;ULHAS RIVER ATJAMBHUL WATER WORKS.;MAHARASHTRA;26;0.53;6.6;0.59;209;0.003;0.68;0.006164321;81.31724319;0
1091;2712;VAITARNA NR RD BDG. GANDHARE VILL.. WADA. THANE;MAHARASHTRA;27;0.58;7.5;0.67;296;0.004;0.14;0.001196062;91.30320058;0
1098;21;CHALIYAR AT CHUNGAPALLY;KERALA;26.2;0.54;7;0.62;5228;0.079;0.34;0.003036158;50.20124203;0
1102;1155;KARAMANA AT MOONNATTUMUKKU;KERALA;27.6;0.62;0.6;0.04;1787;0.027;1.49;0.013616708;385.3496206;0
1116;1565;PAMBA DOWN;KERALA;29.3;0.71;6.5;0.58;70;0.001;1.25;0.011408593;50.23191014;0
1124;1573;IRUMPANAM;KERALA;28.1;0.64;2.2;0.18;625;0.009;1.29;0.011776612;96.17052261;0
1135;2294;R KALLAI AT KALLAI BRIDGE;KERALA;26;0.53;2.8;0.24;18256;0.278;0.47;0.00423222;105.6541675;0
1136;2295;CORAPUZHA AT KANAYANKODE;KERALA;26.5;0.56;5.3;0.47;9753;0.148;0.26;0.00230012;94.29697362;0
1146;1444;KALI AT D/S WEST COAST PAPER MILL;KARNATAKA;28.8;0.68;7.3;0.65;308;0.005;2.43;0.022265158;80.44348783;0
1147;1456;RUSHIKULYA AT GANJAM D/S. ;ODISHA;30.8;0.79;6.8;0.61;23761;0.362;0.67;0.006072316;76.83795594;0
1148;1642;NAGAVALLI AT JAYKAYPUR D/S. ;ODISHA;28;0.64;7.5;0.67;228;0.003;0.4;0.003588187;148.1422672;0
1149;1643;NAGAVALLI AT RAYAGADA D/S. ;ODISHA;27.3;0.6;7.7;0.69;243;0.004;0.71;0.006440335;110.2172867;0
1150;2422;PENTA U/S. JAYKAYPUR TOWN;ODISHA;29;0.69;7.6;0.68;191;0.003;0.13;0.001104057;88.44062029;0
1151;2423;BUDHABALANGA. D/S OF BARIPADA TOWN;ODISHA;24.5;0.44;7.5;0.67;237;0.003;0.45;0.004048211;93.42211391;0
1152;2424;BUDHABALANGA AT BALASORE D/S;ODISHA;24.8;0.46;7.4;0.66;865;0.013;0.3;0.002668139;93.15066087;0
1154;2426;MUNIGUDA (D/S OF M/S VEDANTAALUMINA PROJECT);ODISHA;26.8;0.57;7.1;0.63;211;0.003;0.48;0.004324225;88.19528174;0
1155;2427;GUNUPUR (INTERSTATE BOUNDRY);ODISHA;29;0.69;6.7;0.6;182;0.003;0.24;0.00211611;80.00904957;0
1156;2442;GAUTAMINANGODAVARI RIVER;PONDICHERRY;29;0.69;7.4;0.66;434;0.006;0.05;0.000368019;88.94280754;0
1157;2443;GAUTAMINANGODAVARI RIVER;PONDICHERRY;28;0.64;6.4;0.57;565;0.008;0.05;0.000368019;85.1024971;0
1158;2444;CORINGA RIVER;PONDICHERRY;28;0.64;6.9;0.61;238;0.003;0.05;0.000368019;109.0091223;0
1160;1159;TAMBIRAPARANI AT BDG.NR. MADURA COATS LTD. PAPAVINASAM;TAMILNADU;24.8;0.46;7.4;0.66;75;0.001;0.05;0.000368019;50.57318754;0
1167;1450;PALAR AT VANIYAMBADI WATER SUPPLY HEAD WORK;TAMILNADU;28.2;0.65;6.4;0.57;860;0.013;0.4;0.003588187;84.98434377;0
1172;1025;GHAGGAR GHNAN1 AT ROAD BRDG. SIRSA.DEBWALI ROAD.HARYANA;HARYANA;15;-0.08;6.5;0.58;450;0.007;12;0.110313736;215.3826435;0
1173;1026;GHAGGAR GHNAN2 AT CHANDARPUR SYPHON.  HARYANA;HARYANA;23.5;0.39;6.1;0.54;825;0.012;14;0.128714693;203.376158;0
1174;1885;GHAGGAR AT D/S OF SURAJPUR;HARYANA;27;0.58;6.5;0.58;240;0.003;0.62;0.005612292;92.54463014;0
1175;1887;GHAGGAR BEFORE OTTU WEIR (BEFORE MIXING OF SATLUJ CANAL WATER) (HARYANA);HARYANA;15;-0.08;6.9;0.61;480;0.007;16;0.14711565;217.374229;0
1176;1023;GHAGGAR AT MUBARAKPUR REST HOUSE (PATIALA). PUNJAB;PUNJAB;20.3;0.21;5.6;0.5;807;0.012;2;0.018308952;176.0701328;0
1177;1024;GHAGGAR AT 100M D/S CONF. WITH R. SARASWATI (PATIALA).PUNJAB;PUNJAB;20;0.19;4.9;0.43;1097;0.017;4.8;0.044070292;598.1125748;0
1178;1295;GHAGGAR NEAR BANKARPUR.DERA BASSI.PUNJAB;PUNJAB;20;0.19;4.9;0.43;834;0.013;2.6;0.023829239;221.7778814;0
1179;1473;GHAGGAR AT RATANHERI. D/S OF PATIALA NADI (AFTER CONFL.);PUNJAB;19.8;0.18;5.2;0.46;1027;0.015;5.9;0.054190818;688.1411806;0
1180;1718;GAGGAR  ENTERING IN  FROM HARYANA NR RD NO. 629. ;RAJASTHAN;32.7;0.9;3.3;0.28;897;0.013;0.97;0.008832459;81.91095942;0
1182;1703;GHAGGER AT MOONAK. PUNJAB;PUNJAB;19.8;0.18;5;0.44;1172;0.018;3.8;0.034869813;624.1226545;0
1183;1884;KALA AMB D/S MARKANDA RIVER;HARYANA;27;0.58;4.8;0.42;599;0.009;3.75;0.034409789;4842.690302;0
1184;1698;D/S CHHATBIR. PUNJAB;PUNJAB;20.5;0.22;4.7;0.41;906;0.014;7.7;0.070751679;797.2163954;0
1185;1699;U/S DHAKANSU NALLAH. PUNJAB;PUNJAB;20.5;0.22;5.4;0.48;883;0.013;5.1;0.046830435;392.59566;0
1186;1700;D/S DHAKANSU NALLAH. PUNJAB;PUNJAB;20.5;0.22;5.1;0.45;1069;0.016;6.6;0.060631153;750.0140409;0
1187;1701;D/S JHARMAL NADI. PUNJAB;PUNJAB;21;0.25;4.2;0.37;1168;0.018;7.6;0.069831631;795.2605368;0
1188;1702;U/S JHARMAL NADI. PUNJAB;PUNJAB;20.3;0.21;4.8;0.42;905;0.014;3.3;0.030269574;308.4524217;0
1189;1704;D/S SARDULGARH. PUNJAB;PUNJAB;20;0.19;4.5;0.39;1269;0.019;4.1;0.037629957;784.0938293;0
1190;1705;U/S SARDULGARH. PUNJAB;PUNJAB;20;0.19;4.7;0.41;1216;0.018;3.7;0.033949765;580.080262;0
1195;1424;IMPHAL AT MAHABALI. MANIPUR;MANIPUR;24;0.42;4.88;0.43;149;0.002;0.52;0.004692244;91.81308551;0
1199;1625;HUMP BRIDGE. MANIPUR;MANIPUR;23;0.36;2.7;0.23;357;0.005;0.52;0.004692244;143.5493612;0
1200;1626;HEIRANGOITHONG. MANIPUR;MANIPUR;24;0.42;2.98;0.26;422;0.006;0.52;0.004692244;119.2968777;0
1202;1628;MINUTHONG(IMPHAL RIVER. MANIPUR;MANIPUR;23;0.36;5.13;0.45;162;0.002;0.52;0.004692244;78.57270812;0
1203;1427;UMTREW AT BYRNIHAT EAST;MEGHALAYA;25;0.47;7.85;0.7;254;0.004;3.35;0.030729598;102.0155362;0
1204;1428;KYRHUKHLA NEAR SUTNGA KHLIERIAT.JAINTIA HILLS DT.;MEGHALAYA;24;0.42;6.58;0.59;655;0.01;4;0.036709909;83.87416725;0
1205;1631;MYNTDU RIVER JOWAI. MEGHALAYA;MEGHALAYA;20;0.19;7.58;0.68;191;0.003;2.65;0.024289263;105.6100177;0
1213;1404;GUMTI AT D/S SOUTH TRIPURA;tripura;28;0.64;6.2;0.55;176;0.003;0.2;0.001748091;95.49333101;0
1214;1726;CHANDRAPUR. AGARTALA D/S OF HAORA RIVER. TRIPURA;tripura;29;0.69;6.3;0.56;198;0.003;0.3;0.002668139;106.2762974;0
1216;1246;DAMANGANGA AT KACHIGAON D\S (DAMAN).GUJARAT;GUJARAT;29;0.69;6.5;0.58;21417;0.326;0.4;0.003588187;197.9159568;0
1217;2459;DAMANGANGA AT ZARI CAUSE WAY BRIDGE.DAMAN;DAMAN. DIU. DADRA NAGAR HAVELI;30;0.75;6.1;0.54;11855;0.18;18.6;0.171036894;165.5685313;0
1218;2460;DAMANGANGA DISCHARGE POINT OF DISTILLERY. DAMAN;DAMAN. DIU. DADRA NAGAR HAVELI;30;0.75;6.3;0.56;24506;0.373;16.9;0.155396081;1261.630631;0
1219;2461;DAMANGANGA AT DAMAN JETTY. MOTI DAMAN;DAMAN. DIU. DADRA NAGAR HAVELI;30;0.75;5.9;0.52;25343;0.386;7.7;0.070751679;561.4638919;0
1221;2463;DAMANGANGA AT LAVACHA TEMPLE. SILVASSA;DAMAN. DIU. DADRA NAGAR HAVELI;30;0.75;6.2;0.55;368;0.005;3.2;0.029349526;124.695131;0
1222;2464;DAMANGANGA D/S OF M/S SURAT BEVERAGES. VILLAGE DADRA. SILVASSA;DAMAN. DIU. DADRA NAGAR HAVELI;30;0.75;6.7;0.6;354;0.005;2.6;0.023829239;89.16405623;0
1223;2465;DAMANGANGA AT NAROLI BRIDGE. SILVASSA;DAMAN. DIU. DADRA NAGAR HAVELI;33;0.92;6.8;0.61;374;0.006;1.5;0.013708713;245.3970626;0
1224;2466;DAMANGANGA AT VILLAGE NAMDHA. VAPI;DAMAN. DIU. DADRA NAGAR HAVELI;30;0.75;5.9;0.52;7173;0.109;58.1;0.534455792;163.2411319;0
1226;1860;BALEHWAR KHADI AT N.H. NO. 8;GUJARAT;30;0.75;5.7;0.5;601;0.009;0.5;0.004508234;454.8349458;0
1227;1861;RIVER PURNA ON BRIDGE AT SURATNANNAVSARI HIGHWAY;GUJARAT;30;0.75;4.7;0.41;753;0.011;0.5;0.004508234;310.4301954;0
1228;1862;RIVER KAVERI ON BRIDGE AT BILLIMORANANVALSAD ROAD;GUJARAT;28;0.64;5.8;0.51;16177;0.246;0.5;0.004508234;315.1032588;0
1229;1865;RIVER DHADAR AT KOTHADA;GUJARAT;30;0.75;2.5;0.21;1108;0.017;0.6;0.005428282;120.6851817;0
1230;1148;AMBIKA AT BILIMORA. GUJARAT;GUJARAT;30;0.75;6.1;0.54;14921;0.227;0.3;0.002668139;191.8577113;0
1231;1434;AMLAKHADI AFTER CONFL. OF W. WATER FROM ANKLESH.GUJARAT;GUJARAT;30;0.75;0.6;0.04;3115;0.047;1.7;0.015548809;494.7958406;0
1232;1436;BHADAR D/S JETPUR VILL. AFTER CONF. OF W.WATER FROM JETPUR CITY.GUJARAT;GUJARAT;27;0.58;3.2;0.28;5073;0.077;0.2;0.001748091;139.9212597;0
1233;1438;MINDHOLA AT STATE HIGHWAY BRIDGE SACHIN. GUJARAT;GUJARAT;30;0.75;4.2;0.37;901;0.014;0.4;0.003588187;350.6203968;0
1234;2072;RIVER BHOGAVO D/S OF SURENDRANAGAR.;GUJARAT;28;0.64;2.9;0.25;11405;0.173;0.1;0.000828043;132.0618672;0
1235;2082;TRIVENI SANGAM. NR. SOMNATH TEMPLE. VERAVAL. DIST. JUNAGADH.;GUJARAT;29;0.69;5;0.44;47156;0.718;0.1;0.000828043;97.09398116;0
1249;2273;RIVER SAL NEAR HOTEL LEELA MOBOR.CAVELOSSIM;GOA;29;0.69;5.1;0.45;198;0.003;0.38;0.003404177;101.7559475;0
1253;1092;KALU AT ATALE VILLAGE. MAHARASHTRA;MAHARASHTRA;28;0.64;5.5;0.49;8092;0.123;0.72;0.00653234;134.302073;0
1254;1093;ULHAS AT U/S OF NRC BUND AT MOHANE. MAHARASHTRA;MAHARASHTRA;29;0.69;6.9;0.61;136;0.002;0.26;0.00230012;84.38392232;0
1255;1094;ULHAS AT U/S OF BADLAPUR. MAHARASHTRA;MAHARASHTRA;29;0.69;6.9;0.61;120;0.002;0.37;0.003312172;88.42164899;0
1256;1461;BHATSA AT D/S OF PISE DAM NEAR PISE VILLAGE (ULHAS). MAHARASHTRA;MAHARASHTRA;28;0.64;6.7;0.6;111;0.002;0.31;0.002760144;88.3173429;0
1257;1462;PATALGANGA NEAR INTAKE OF MIDC W/W. MAHARASHTRA;MAHARASHTRA;26;0.53;6.9;0.61;229;0.003;0.68;0.006164321;78.45736232;0
1258;2162;ULHAS RIVER ATJAMBHUL WATER WORKS.;MAHARASHTRA;29;0.69;6.8;0.61;171;0.002;0.34;0.003036158;81.90575594;0
1260;2168;MITHI RIVER;MAHARASHTRA;34;0.97;3.3;0.28;29464;0.448;1.78;0.016284847;269.9317394;0
1261;2198;KUNDALIKA RIVER AT ARE KHURD ( SALINE ZONE );MAHARASHTRA;32;0.86;5.4;0.48;925;0.014;0.78;0.007084368;157.86772;0
1263;1151;PATALGANGA AT SHILPHATA. MAHARASHTRA;MAHARASHTRA;26;0.53;7;0.62;225;0.003;0.26;0.00230012;80.66383536;0
1264;1152;KUNDALIKA AT ROHA CITY. MAHARASHTRA;MAHARASHTRA;35;1.03;6.6;0.59;102;0.001;0.26;0.00230012;95.87902319;0
1272;1155;KARAMANA AT MOONNATTUMUKKU. KERALA;KERALA;26;0.53;0.7;0.05;4235;0.064;1.48;0.013524703;1087.15164;0
1293;2284;R NEYYAR AT ARUVIPURAM;KERALA;26;0.53;6.6;0.59;72;0.001;0.32;0.002852148;50.12258319;0
1303;2294;R KALLAI AT KALLAI BRIDGE;KERALA;27;0.58;3.5;0.3;20430;0.311;0.62;0.005612292;87.33843884;0
1312;2303;R PULLUR AT PULLUR BR.;KERALA;27;0.58;5.8;0.51;59;0.001;0.13;0.001104057;87.35420551;0
1313;2304;R MOGRAL AT MOGRAL BR.;KERALA;28;0.64;5.2;0.46;19885;0.303;0.18;0.001564081;82.84175391;0
1314;2305;R SHRIYA AT ANGADIMOGARU;KERALA;27;0.58;7.7;0.69;67;0.001;0.08;0.000644033;76.66382667;0
1315;2306;R UPPALA AT  UPPALA BR.;KERALA;28;0.64;5.7;0.5;19085;0.29;0.09;0.000736038;104.2772791;0
1325;2337;R KADAMBAYAR AT BRAHMAPURAM;KERALA;28;0.64;1.4;0.11;129;0.002;0.48;0.004324225;77.12187826;0
1328;1455;RUSHIKULYA AT GANJAM U/S. ORISSA;ODISHA;30;0.75;7.7;0.69;330;0.005;0.9;0.008188426;106.9638;0
1329;1456;RUSHIKULYA AT GANJAM D/S. ORISSA;ODISHA;30;0.75;7.5;0.67;20786;0.316;0.6;0.005428282;79.66555391;0
1330;1642;NAGAVALLI AT JAYKAYPUR D/S. ORISSA;ODISHA;28;0.64;7.2;0.64;315;0.005;1.7;0.015548809;130.1365014;0
1331;1643;NAGAVALLI AT RAYAGADA D/S. ORISSA;ODISHA;28;0.64;7.6;0.68;301;0.004;0.5;0.004508234;119.2454736;0
1332;2422;NAGAVALI PENTA U/S. JAYKAYPUR TOWN;ODISHA;28;0.64;7.3;0.65;225;0.003;0.5;0.004508234;93.18911449;0
1333;2423;BUDHABALANGA. D/S OF BARIPADA TOWN;ODISHA;27;0.58;7.4;0.66;238;0.003;0.2;0.001748091;135.4007875;0
1334;2424;BUDHABALANGA AT BALASORE D/S;ODISHA;27;0.58;7.2;0.64;835;0.013;0.7;0.00634833;100.5766681;0
1336;2426;Vansdhara MUNIGUDA (D/S OF M/S VEDANTAALUMINA PROJECT);ODISHA;28;0.64;7;0.62;240;0.003;0.4;0.003588187;82.29114203;0
1337;2427;Vansdhara GUNUPUR (INTERSTATE BOUNDRY);ODISHA;29;0.69;7.4;0.66;153;0.002;0.5;0.004508234;80.27458754;0
1338;2442;GAUTAMINANGODAVARI RIVER;PONDICHERRY;33;0.92;7.7;0.69;220;0.003;11;0.101113258;88.99366667;0
1339;2443;GAUTAMINANGODAVARI RIVER;PONDICHERRY;33;0.92;7.1;0.63;406;0.006;15.8;0.145275554;80.12190841;0
1340;2444;CORINGA RIVER;PONDICHERRY;33;0.92;6.8;0.61;309;0.005;15.3;0.140675315;113.4251626;0
1341;2445;MAHE RIVER;PONDICHERRY;28;0.64;5.1;0.45;4120;0.063;108.7;1;114.6057942;0
1342;1685;ARASALAR RIVER KARAIKAL REGION. PONDICHERRY;PONDICHERRY;21;0.25;7.6;0.68;446;0.007;1.4;0.012788665;77.81807362;0
1351;1444;KALI AT D/S WEST COAST PAPER MILL. KARNATAKA;KARNATAKA;27;0.58;7;0.62;286;0.004;0.9;0.008188426;126.2100087;0
1355;1023;GHAGGAR AT MUBARAKPUR REST HOUSE (PATIALA). PUNJAB;PUNJAB;22;0.31;6;0.53;755;0.011;2.1;0.019229;123.2781783;0
1356;1024;GHAGGAR AT 100M D/S CONF. WITH R. SARASWATI (PATIALA).PUNJAB;PUNJAB;21;0.25;4.9;0.43;892;0.013;4.4;0.0403901;371.5147414;0
1357;1025;GHAGGAR GHNAN1 AT ROAD BRDG. SIRSA.DEBWALI ROAD.HARYANA;HARYANA;22;0.31;6.4;0.57;1085;0.016;8.1;0.07443187;122.8030304;0
1358;1026;GHAGGAR GHNAN2 AT CHANDARPUR SYPHON.  HARYANA;HARYANA;20;0.19;5.6;0.5;905;0.014;7.1;0.065231392;170.4187928;0
1359;1295;GHAGGAR NEAR BANKARPUR.DERA BASSI.PUNJAB;PUNJAB;22;0.31;5;0.44;813;0.012;2.2;0.020149048;138.4957412;0
1360;1473;GHAGGAR AT RATANHERI. D/S OF PATIALA NADI (AFTER CONFL.). PUNJAB;PUNJAB;21;0.25;5.6;0.5;964;0.015;4.2;0.038550005;365.3051061;0
1361;1698;GHAGGAR AT D/S CHHATBIR. PUNJAB;PUNJAB;20;0.19;5.7;0.5;968;0.015;3.1;0.028429478;250.5166325;0
1362;1699;GHAGGAR AT U/S DHAKANSU NALLAH. PUNJAB;PUNJAB;21;0.25;5.3;0.47;779;0.012;3.1;0.028429478;306.9654003;0
1363;1700;D/S DHAKANSU NALLAH. PUNJAB;PUNJAB;21;0.25;4.8;0.42;825;0.012;4.6;0.042230196;449.4129551;0
1364;1701;GHAGGAR AT D/S JHARMAL NADI. PUNJAB;PUNJAB;23;0.36;2.9;0.25;1035;0.016;3.9;0.035789861;250.6802739;0
1365;1702;GHAGGAR AT U/S JHARMAL NADI. PUNJAB;PUNJAB;21;0.25;4.5;0.39;885;0.013;3.3;0.030269574;172.5132826;0
1366;1703;GHAGGER AT MOONAK. PUNJAB;PUNJAB;20;0.19;4.8;0.42;896;0.013;4.1;0.037629957;315.0919084;0
1367;1704;GHAGGAR AT D/S SARDULGARH. PUNJAB;PUNJAB;24;0.42;3.1;0.27;1130;0.017;4.1;0.037629957;383.6358667;0
1368;1705;GHAGGAR AT U/S SARDULGARH. PUNJAB;PUNJAB;25;0.47;3.1;0.27;1000;0.015;3.7;0.033949765;301.2355333;0
1369;1884;GHAGGAR AT KALA AMB D/S MARKANDA RIVER;HARYANA;28;0.64;1.9;0.16;2187;0.033;5.4;0.049590579;3225.333183;0
1370;1885; RIVER GHAGGAR AT D/S OF SURAJPUR;HARYANA;28;0.64;7;0.62;350;0.005;0.52;0.004692244;77.96606203;0
1371;1887;GHAGGAR BEFORE OTTU WEIR (BEFORE MIXING OF SATLUJ CANAL WATER) (HARYANA);HARYANA;16;-0.03;7.2;0.64;930;0.014;1.5;0.013708713;98.14863478;0
1372;1870;RIVER SUKHANA AT PARWANOO. DISTT. SOLAN. H.P.;HIMACHAL PRADESH;22;0.31;5.475;0.48;;0;1.26;0.011500598;121.4926798;0
1378;1625;NAMBUL HUMP BRIDGE. MANIPUR;MANIPUR;25;0.47;1.9;0.16;537;0.008;0.52;0.004692244;159.3806368;0
1379;1626;NAMBUL HEIRANGOITHONG. MANIPUR;MANIPUR;25;0.47;7.7;0.69;550;0.008;0.52;0.004692244;135.9236133;0
1391;1404;GUMTI AT D/S SOUTH TRIPURA. TRIPURA;TRIPURA;29;0.69;6.3;0.56;164;0.002;0.1;0.000828043;85.07397072;0
1392;1726;CHANDRAPUR. AGARTALA D/S OF HAORA RIVER. TRIPURA;TRIPURA;28;0.64;5.7;0.5;170;0.002;0.2;0.001748091;97.3594658;0
1393;1631;MYNTDU JAINTIA HILLS MEGHALAYA;MEGHALAYA;21;0.25;6.4;0.57;;0;2.675;0.024519275;118.1379757;0
1398;1246;DAMANGANGA AT KACHIGAON D\S (DAMAN).GUJARAT;GUJARAT;25;0.47;4.9;0.43;10362;0.158;0.64;0.005796301;142.1392281;0
1399;1860;BALEHWAR KHADI AT N.H. NO. 8;GUJARAT;27;0.58;5.1;0.45;530;0.008;0.6;0.005428282;1531.241921;0
1400;1861;RIVER PURNA ON BRIDGE AT SURATNANNAVSARI HIGHWAY;GUJARAT;28;0.64;6;0.53;612;0.009;0.4;0.003588187;730.8344116;0
1401;1862;RIVER KAVERI ON BRIDGE AT BILLIMORANANVALSAD ROAD;GUJARAT;30;0.75;6.1;0.54;8782;0.134;0.43;0.003864201;443.1029846;0
1402;1865;RIVER DHADAR AT KOTHADA;GUJARAT;27;0.58;1.1;0.08;1076;0.016;0.63;0.005704297;147.6709191;0
1403;1148;AMBIKA AT BILIMORA. GUJARAT;GUJARAT;29;0.69;6.8;0.61;3431;0.052;0.3;0.002668139;801.1034226;0
1404;1149;KOLAK AT PATALIA BDG.. GUJARAT;GUJARAT;25;0.47;4.5;0.39;1161;0.018;0.53;0.004784249;127.3343893;0
1405;1435;KOLAK AT RAILWAY BRIDGE NO. 313 VAPI.VALSAD. GUJARAT;GUJARAT;25;0.47;6;0.53;8838;0.134;0.7;0.00634833;98.31275159;0
1406;1434;AMLAKHADI AFTER CONFL. OF W. WATER FROM ANKLESH.GUJARAT;GUJARAT;30;0.75;0;-0.02;3080;0.047;4.8;0.044070292;548.6490957;0
1407;1438;MINDHOLA AT STATE HIGHWAY BRIDGE SACHIN. GUJARAT;GUJARAT;28;0.64;2.8;0.24;663;0.01;0.97;0.008832459;3524.421534;0
1408;1436;BHADAR D/S JETPUR VILL. AFTER CONF. OF W.WATER FROM JETPUR CITY.GUJARAT;GUJARAT;29;0.69;5.6;0.5;1265;0.019;0.1;0.000828043;91.29057942;0
1409;2072;RIVER BHOGAVO D/S OF SURENDRANAGAR.;GUJARAT;28;0.64;4.1;0.36;4491;0.068;0.1;0.000828043;214.5024038;0
1410;2082;TRIVENI SANGAM. NR. SOMNATH TEMPLE. VERAVAL. DIST. JUNAGADH.;GUJARAT;29;0.69;6.3;0.56;43983;0.669;1.22;0.011132579;83.92488406;0
1413;1476;MANDOVI AT TONCA. MARCELA. GOA;GOA;27;0.58;6.5;0.58;28;0;0.05;0.000368019;88.38795014;0
1423;2272;RIVER KUSHAWATI NEAR BUND AT KEVONA.RIVON.SANGUEM;GOA;26;0.53;6.2;0.55;146;0.002;0.09;0.000736038;81.63846435;0
1426;2276;RIVER BICHOLIM VARAZAN NAGAR . BICHOLIM;GOA;28;0.64;8.1;0.72;335;0.005;0.21;0.001840096;91.34771217;0
1427;1093;ULHAS AT U/S OF NRC BUND AT MOHANE. MAHARASHTRA;MAHARASHTRA;26;0.53;6.3;0.56;119;0.002;0.37;0.003312172;86.54121072;0
1428;1094;ULHAS AT U/S OF BADLAPUR. MAHARASHTRA;MAHARASHTRA;27;0.58;6.4;0.57;109;0.001;0.42;0.003772196;82.20085043;0
1429;2162;ULHAS RIVER ATJAMBHUL WATER WORKS.;MAHARASHTRA;27;0.58;5.9;0.52;119;0.002;0.65;0.005888306;84.17425188;0
